chunk_id,chunk_type,source_id,chapter_id,chapter_name,concept_id,concept_name,difficulty,title,content,search_text,doc_id
theory::c_fundamental_theorem_arithmetic,theory,c_fundamental_theorem_arithmetic,ch_real_numbers,Real Numbers,c_fundamental_theorem_arithmetic,Fundamental Theorem of Arithmetic,medium,Theory: Fundamental Theorem of Arithmetic,"Concept: Fundamental Theorem of Arithmetic. Description: Use unique prime factorization to reason about divisibility, HCF, LCM, and denominator structure.. Learning objective: Apply prime factorization as the central theorem for Class X real-number reasoning.. Tags: prime_factorization, divisibility, theorem","Theory: Fundamental Theorem of Arithmetic Real Numbers Fundamental Theorem of Arithmetic medium Concept: Fundamental Theorem of Arithmetic. Description: Use unique prime factorization to reason about divisibility, HCF, LCM, and denominator structure.. Learning objective: Apply prime factorization as the central theorem for Class X real-number reasoning.. Tags: prime_factorization, divisibility, theorem",theory::c_fundamental_theorem_arithmetic
theory::c_euclid_division_lemma,theory,c_euclid_division_lemma,ch_real_numbers,Real Numbers,c_euclid_division_lemma,Euclid Division Lemma,easy,Theory: Euclid Division Lemma,"Concept: Euclid Division Lemma. Description: Represent an integer as a = bq + r and use that decomposition to support HCF reasoning.. Learning objective: Use Euclid-style quotient and remainder decomposition as a bridge into HCF computations.. Tags: division, algorithm, review","Theory: Euclid Division Lemma Real Numbers Euclid Division Lemma easy Concept: Euclid Division Lemma. Description: Represent an integer as a = bq + r and use that decomposition to support HCF reasoning.. Learning objective: Use Euclid-style quotient and remainder decomposition as a bridge into HCF computations.. Tags: division, algorithm, review",theory::c_euclid_division_lemma
theory::c_hcf_lcm,theory,c_hcf_lcm,ch_real_numbers,Real Numbers,c_hcf_lcm,HCF and LCM,medium,Theory: HCF and LCM,"Concept: HCF and LCM. Description: Connect prime factorization and algorithmic reasoning to highest common factor and least common multiple.. Learning objective: Compute HCF and LCM using theorem-based number reasoning.. Tags: hcf, lcm, prime_factorization","Theory: HCF and LCM Real Numbers HCF and LCM medium Concept: HCF and LCM. Description: Connect prime factorization and algorithmic reasoning to highest common factor and least common multiple.. Learning objective: Compute HCF and LCM using theorem-based number reasoning.. Tags: hcf, lcm, prime_factorization",theory::c_hcf_lcm
theory::c_irrational_numbers,theory,c_irrational_numbers,ch_real_numbers,Real Numbers,c_irrational_numbers,Irrational Numbers,hard,Theory: Irrational Numbers,"Concept: Irrational Numbers. Description: Use contradiction-based arguments to show that selected numbers are irrational.. Learning objective: Distinguish rational and irrational numbers with proof-oriented reasoning.. Tags: irrationality, proof, number_system","Theory: Irrational Numbers Real Numbers Irrational Numbers hard Concept: Irrational Numbers. Description: Use contradiction-based arguments to show that selected numbers are irrational.. Learning objective: Distinguish rational and irrational numbers with proof-oriented reasoning.. Tags: irrationality, proof, number_system",theory::c_irrational_numbers
theory::c_decimal_expansions,theory,c_decimal_expansions,ch_real_numbers,Real Numbers,c_decimal_expansions,Decimal Expansions of Rational Numbers,medium,Theory: Decimal Expansions of Rational Numbers,"Concept: Decimal Expansions of Rational Numbers. Description: Classify rational numbers by terminating or recurring decimal expansion through denominator factorization.. Learning objective: Explain decimal behavior of rational numbers from prime factors of the denominator.. Tags: decimals, rational_numbers, classification","Theory: Decimal Expansions of Rational Numbers Real Numbers Decimal Expansions of Rational Numbers medium Concept: Decimal Expansions of Rational Numbers. Description: Classify rational numbers by terminating or recurring decimal expansion through denominator factorization.. Learning objective: Explain decimal behavior of rational numbers from prime factors of the denominator.. Tags: decimals, rational_numbers, classification",theory::c_decimal_expansions
theory::c_polynomial_degree_terms,theory,c_polynomial_degree_terms,ch_polynomials,Polynomials,c_polynomial_degree_terms,Polynomial Degree and Terms,easy,Theory: Polynomial Degree and Terms,"Concept: Polynomial Degree and Terms. Description: Review polynomial vocabulary including terms, coefficients, and degree as scaffolding for root analysis.. Learning objective: Read polynomial structure before applying Class X zero-based reasoning.. Tags: polynomial_structure, review","Theory: Polynomial Degree and Terms Polynomials Polynomial Degree and Terms easy Concept: Polynomial Degree and Terms. Description: Review polynomial vocabulary including terms, coefficients, and degree as scaffolding for root analysis.. Learning objective: Read polynomial structure before applying Class X zero-based reasoning.. Tags: polynomial_structure, review",theory::c_polynomial_degree_terms
theory::c_zeroes_of_polynomial,theory,c_zeroes_of_polynomial,ch_polynomials,Polynomials,c_zeroes_of_polynomial,Zeroes of a Polynomial,medium,Theory: Zeroes of a Polynomial,"Concept: Zeroes of a Polynomial. Description: Find and interpret the zeroes of a polynomial in line with the official Class X syllabus.. Learning objective: Compute and reason about polynomial zeroes from algebraic forms.. Tags: zeroes, roots, algebra","Theory: Zeroes of a Polynomial Polynomials Zeroes of a Polynomial medium Concept: Zeroes of a Polynomial. Description: Find and interpret the zeroes of a polynomial in line with the official Class X syllabus.. Learning objective: Compute and reason about polynomial zeroes from algebraic forms.. Tags: zeroes, roots, algebra",theory::c_zeroes_of_polynomial
theory::c_zero_coeff_relationship,theory,c_zero_coeff_relationship,ch_polynomials,Polynomials,c_zero_coeff_relationship,Relationship Between Zeroes and Coefficients,medium,Theory: Relationship Between Zeroes and Coefficients,"Concept: Relationship Between Zeroes and Coefficients. Description: Use the sum and product of zeroes to connect quadratic roots with coefficients.. Learning objective: Construct or analyze quadratic polynomials using root-coefficient relationships.. Tags: quadratic, coefficients, roots","Theory: Relationship Between Zeroes and Coefficients Polynomials Relationship Between Zeroes and Coefficients medium Concept: Relationship Between Zeroes and Coefficients. Description: Use the sum and product of zeroes to connect quadratic roots with coefficients.. Learning objective: Construct or analyze quadratic polynomials using root-coefficient relationships.. Tags: quadratic, coefficients, roots",theory::c_zero_coeff_relationship
theory::c_factorisation_remainder,theory,c_factorisation_remainder,ch_polynomials,Polynomials,c_factorisation_remainder,Factorisation and Remainder Theorem,hard,Theory: Factorisation and Remainder Theorem,"Concept: Factorisation and Remainder Theorem. Description: Use polynomial evaluation and factor checks as a supporting skill for zero-based reasoning.. Learning objective: Test factors efficiently while linking factorization to roots.. Tags: factorisation, evaluation, bridge_skill","Theory: Factorisation and Remainder Theorem Polynomials Factorisation and Remainder Theorem hard Concept: Factorisation and Remainder Theorem. Description: Use polynomial evaluation and factor checks as a supporting skill for zero-based reasoning.. Learning objective: Test factors efficiently while linking factorization to roots.. Tags: factorisation, evaluation, bridge_skill",theory::c_factorisation_remainder
theory::c_pair_linear_equations_graphical,theory,c_pair_linear_equations_graphical,ch_pair_linear_equations,Pair of Linear Equations in Two Variables,c_pair_linear_equations_graphical,Graphical Solution of Pair of Linear Equations,easy,Theory: Graphical Solution of Pair of Linear Equations,"Concept: Graphical Solution of Pair of Linear Equations. Description: Represent two linear equations on the Cartesian plane and interpret their point of intersection.. Learning objective: Use graphs to solve linear systems and interpret geometric meaning.. Tags: graphs, intersection, linear_systems","Theory: Graphical Solution of Pair of Linear Equations Pair of Linear Equations in Two Variables Graphical Solution of Pair of Linear Equations easy Concept: Graphical Solution of Pair of Linear Equations. Description: Represent two linear equations on the Cartesian plane and interpret their point of intersection.. Learning objective: Use graphs to solve linear systems and interpret geometric meaning.. Tags: graphs, intersection, linear_systems",theory::c_pair_linear_equations_graphical
theory::c_pair_linear_equations_consistency,theory,c_pair_linear_equations_consistency,ch_pair_linear_equations,Pair of Linear Equations in Two Variables,c_pair_linear_equations_consistency,Consistency and Number of Solutions,medium,Theory: Consistency and Number of Solutions,"Concept: Consistency and Number of Solutions. Description: Use coefficient conditions and graph interpretation to determine whether a system is consistent, inconsistent, or dependent.. Learning objective: Classify a pair of equations by its number of solutions.. Tags: consistency, solution_count, coefficients","Theory: Consistency and Number of Solutions Pair of Linear Equations in Two Variables Consistency and Number of Solutions medium Concept: Consistency and Number of Solutions. Description: Use coefficient conditions and graph interpretation to determine whether a system is consistent, inconsistent, or dependent.. Learning objective: Classify a pair of equations by its number of solutions.. Tags: consistency, solution_count, coefficients",theory::c_pair_linear_equations_consistency
theory::c_pair_linear_equations_algebraic,theory,c_pair_linear_equations_algebraic,ch_pair_linear_equations,Pair of Linear Equations in Two Variables,c_pair_linear_equations_algebraic,Algebraic Methods for Pair of Linear Equations,medium,Theory: Algebraic Methods for Pair of Linear Equations,"Concept: Algebraic Methods for Pair of Linear Equations. Description: Solve linear systems by substitution or elimination and apply them in simple situational problems.. Learning objective: Solve two-variable linear systems algebraically and in context.. Tags: substitution, elimination, applications","Theory: Algebraic Methods for Pair of Linear Equations Pair of Linear Equations in Two Variables Algebraic Methods for Pair of Linear Equations medium Concept: Algebraic Methods for Pair of Linear Equations. Description: Solve linear systems by substitution or elimination and apply them in simple situational problems.. Learning objective: Solve two-variable linear systems algebraically and in context.. Tags: substitution, elimination, applications",theory::c_pair_linear_equations_algebraic
theory::c_quadratic_factorization,theory,c_quadratic_factorization,ch_quadratic_equations,Quadratic Equations,c_quadratic_factorization,Quadratic Equations by Factorization,easy,Theory: Quadratic Equations by Factorization,"Concept: Quadratic Equations by Factorization. Description: Solve quadratic equations with real roots by expressing the polynomial as a product of linear factors.. Learning objective: Solve suitable quadratic equations by factorization.. Tags: factorization, real_roots, quadratics","Theory: Quadratic Equations by Factorization Quadratic Equations Quadratic Equations by Factorization easy Concept: Quadratic Equations by Factorization. Description: Solve quadratic equations with real roots by expressing the polynomial as a product of linear factors.. Learning objective: Solve suitable quadratic equations by factorization.. Tags: factorization, real_roots, quadratics",theory::c_quadratic_factorization
theory::c_quadratic_formula,theory,c_quadratic_formula,ch_quadratic_equations,Quadratic Equations,c_quadratic_formula,Quadratic Formula,medium,Theory: Quadratic Formula,"Concept: Quadratic Formula. Description: Use the quadratic formula to solve any quadratic equation with real roots in standard form.. Learning objective: Apply the quadratic formula accurately to Class X equations.. Tags: formula, standard_form, quadratics","Theory: Quadratic Formula Quadratic Equations Quadratic Formula medium Concept: Quadratic Formula. Description: Use the quadratic formula to solve any quadratic equation with real roots in standard form.. Learning objective: Apply the quadratic formula accurately to Class X equations.. Tags: formula, standard_form, quadratics",theory::c_quadratic_formula
theory::c_discriminant_nature_roots,theory,c_discriminant_nature_roots,ch_quadratic_equations,Quadratic Equations,c_discriminant_nature_roots,Discriminant and Nature of Roots,medium,Theory: Discriminant and Nature of Roots,"Concept: Discriminant and Nature of Roots. Description: Use the discriminant to infer whether a quadratic equation has distinct, repeated, or no real roots.. Learning objective: Relate discriminant value to the nature of quadratic roots.. Tags: discriminant, root_nature, quadratics","Theory: Discriminant and Nature of Roots Quadratic Equations Discriminant and Nature of Roots medium Concept: Discriminant and Nature of Roots. Description: Use the discriminant to infer whether a quadratic equation has distinct, repeated, or no real roots.. Learning objective: Relate discriminant value to the nature of quadratic roots.. Tags: discriminant, root_nature, quadratics",theory::c_discriminant_nature_roots
theory::c_quadratic_applications,theory,c_quadratic_applications,ch_quadratic_equations,Quadratic Equations,c_quadratic_applications,Situational Problems on Quadratic Equations,hard,Theory: Situational Problems on Quadratic Equations,"Concept: Situational Problems on Quadratic Equations. Description: Translate day-to-day contexts into quadratic equations and solve them with an appropriate method.. Learning objective: Model simple real-life situations using quadratic equations.. Tags: word_problems, modelling, applications","Theory: Situational Problems on Quadratic Equations Quadratic Equations Situational Problems on Quadratic Equations hard Concept: Situational Problems on Quadratic Equations. Description: Translate day-to-day contexts into quadratic equations and solve them with an appropriate method.. Learning objective: Model simple real-life situations using quadratic equations.. Tags: word_problems, modelling, applications",theory::c_quadratic_applications
theory::c_ap_nth_term,theory,c_ap_nth_term,ch_arithmetic_progressions,Arithmetic Progressions,c_ap_nth_term,Nth Term of an Arithmetic Progression,easy,Theory: Nth Term of an Arithmetic Progression,"Concept: Nth Term of an Arithmetic Progression. Description: Use the common difference and first term to derive or compute the nth term of an A.P.. Learning objective: Find any requested term in an arithmetic progression.. Tags: ap, nth_term, sequence","Theory: Nth Term of an Arithmetic Progression Arithmetic Progressions Nth Term of an Arithmetic Progression easy Concept: Nth Term of an Arithmetic Progression. Description: Use the common difference and first term to derive or compute the nth term of an A.P.. Learning objective: Find any requested term in an arithmetic progression.. Tags: ap, nth_term, sequence",theory::c_ap_nth_term
theory::c_ap_sum,theory,c_ap_sum,ch_arithmetic_progressions,Arithmetic Progressions,c_ap_sum,Sum of First n Terms of an Arithmetic Progression,medium,Theory: Sum of First n Terms of an Arithmetic Progression,"Concept: Sum of First n Terms of an Arithmetic Progression. Description: Derive and use the sum formula for the first n terms of an arithmetic progression.. Learning objective: Compute cumulative totals in an arithmetic progression.. Tags: ap, sum, series","Theory: Sum of First n Terms of an Arithmetic Progression Arithmetic Progressions Sum of First n Terms of an Arithmetic Progression medium Concept: Sum of First n Terms of an Arithmetic Progression. Description: Derive and use the sum formula for the first n terms of an arithmetic progression.. Learning objective: Compute cumulative totals in an arithmetic progression.. Tags: ap, sum, series",theory::c_ap_sum
theory::c_ap_applications,theory,c_ap_applications,ch_arithmetic_progressions,Arithmetic Progressions,c_ap_applications,Applications of Arithmetic Progressions,medium,Theory: Applications of Arithmetic Progressions,"Concept: Applications of Arithmetic Progressions. Description: Model and solve daily-life problems whose structure follows an arithmetic progression.. Learning objective: Translate contextual patterns into A.P. terms or sums.. Tags: ap, applications, modelling","Theory: Applications of Arithmetic Progressions Arithmetic Progressions Applications of Arithmetic Progressions medium Concept: Applications of Arithmetic Progressions. Description: Model and solve daily-life problems whose structure follows an arithmetic progression.. Learning objective: Translate contextual patterns into A.P. terms or sums.. Tags: ap, applications, modelling",theory::c_ap_applications
theory::c_distance_formula,theory,c_distance_formula,ch_coordinate_geometry,Coordinate Geometry,c_distance_formula,Distance Formula,easy,Theory: Distance Formula,"Concept: Distance Formula. Description: Compute the distance between two points in the Cartesian plane using the standard formula.. Learning objective: Apply the distance formula accurately in coordinate problems.. Tags: distance, coordinates","Theory: Distance Formula Coordinate Geometry Distance Formula easy Concept: Distance Formula. Description: Compute the distance between two points in the Cartesian plane using the standard formula.. Learning objective: Apply the distance formula accurately in coordinate problems.. Tags: distance, coordinates",theory::c_distance_formula
theory::c_section_formula,theory,c_section_formula,ch_coordinate_geometry,Coordinate Geometry,c_section_formula,Section Formula,medium,Theory: Section Formula,"Concept: Section Formula. Description: Find the point that divides a line segment internally in a given ratio.. Learning objective: Use weighted averages to locate an internal division point.. Tags: section_formula, ratio, coordinates","Theory: Section Formula Coordinate Geometry Section Formula medium Concept: Section Formula. Description: Find the point that divides a line segment internally in a given ratio.. Learning objective: Use weighted averages to locate an internal division point.. Tags: section_formula, ratio, coordinates",theory::c_section_formula
theory::c_area_of_triangle,theory,c_area_of_triangle,ch_coordinate_geometry,Coordinate Geometry,c_area_of_triangle,Area of a Triangle in Coordinates,medium,Theory: Area of a Triangle in Coordinates,"Concept: Area of a Triangle in Coordinates. Description: Use coordinate area reasoning to compute triangle area or check collinearity as an applied extension.. Learning objective: Use coordinate-based area reasoning in triangle problems.. Tags: triangle_area, coordinates, collinearity","Theory: Area of a Triangle in Coordinates Coordinate Geometry Area of a Triangle in Coordinates medium Concept: Area of a Triangle in Coordinates. Description: Use coordinate area reasoning to compute triangle area or check collinearity as an applied extension.. Learning objective: Use coordinate-based area reasoning in triangle problems.. Tags: triangle_area, coordinates, collinearity",theory::c_area_of_triangle
theory::c_similar_triangles,theory,c_similar_triangles,ch_triangles,Triangles,c_similar_triangles,Similar Triangles,easy,Theory: Similar Triangles,"Concept: Similar Triangles. Description: Identify and justify similarity between triangles from equal angles or proportional sides.. Learning objective: Apply the Class X similarity criteria to establish triangle similarity.. Tags: similarity, criteria, proof","Theory: Similar Triangles Triangles Similar Triangles easy Concept: Similar Triangles. Description: Identify and justify similarity between triangles from equal angles or proportional sides.. Learning objective: Apply the Class X similarity criteria to establish triangle similarity.. Tags: similarity, criteria, proof",theory::c_similar_triangles
theory::c_basic_proportionality_theorem,theory,c_basic_proportionality_theorem,ch_triangles,Triangles,c_basic_proportionality_theorem,Basic Proportionality Theorem,medium,Theory: Basic Proportionality Theorem,"Concept: Basic Proportionality Theorem. Description: If a line is drawn parallel to one side of a triangle, it divides the other two sides in the same ratio.. Learning objective: Use BPT and its converse to solve segment-length problems in triangles.. Tags: bpt, parallel_lines, proportion","Theory: Basic Proportionality Theorem Triangles Basic Proportionality Theorem medium Concept: Basic Proportionality Theorem. Description: If a line is drawn parallel to one side of a triangle, it divides the other two sides in the same ratio.. Learning objective: Use BPT and its converse to solve segment-length problems in triangles.. Tags: bpt, parallel_lines, proportion",theory::c_basic_proportionality_theorem
theory::c_pythagoras_theorem,theory,c_pythagoras_theorem,ch_triangles,Triangles,c_pythagoras_theorem,Pythagoras Theorem,medium,Theory: Pythagoras Theorem,"Concept: Pythagoras Theorem. Description: Use right-triangle side relationships as a supporting skill for geometry and trigonometry problems.. Learning objective: Compute unknown side lengths in right triangles.. Tags: pythagoras, right_triangle, bridge_skill","Theory: Pythagoras Theorem Triangles Pythagoras Theorem medium Concept: Pythagoras Theorem. Description: Use right-triangle side relationships as a supporting skill for geometry and trigonometry problems.. Learning objective: Compute unknown side lengths in right triangles.. Tags: pythagoras, right_triangle, bridge_skill",theory::c_pythagoras_theorem
theory::c_similarity_area_ratio,theory,c_similarity_area_ratio,ch_triangles,Triangles,c_similarity_area_ratio,Criteria for Similarity and Area Ratio,hard,Theory: Criteria for Similarity and Area Ratio,"Concept: Criteria for Similarity and Area Ratio. Description: Extend similarity reasoning to area ratios and proof-oriented questions on corresponding parts.. Learning objective: Connect side-ratio similarity to area scaling arguments.. Tags: similarity, area_ratio, proof","Theory: Criteria for Similarity and Area Ratio Triangles Criteria for Similarity and Area Ratio hard Concept: Criteria for Similarity and Area Ratio. Description: Extend similarity reasoning to area ratios and proof-oriented questions on corresponding parts.. Learning objective: Connect side-ratio similarity to area scaling arguments.. Tags: similarity, area_ratio, proof",theory::c_similarity_area_ratio
theory::c_tangent_radius_perpendicular,theory,c_tangent_radius_perpendicular,ch_circles,Circles,c_tangent_radius_perpendicular,Tangent Perpendicular to Radius,easy,Theory: Tangent Perpendicular to Radius,"Concept: Tangent Perpendicular to Radius. Description: Use the theorem that the tangent at a point of a circle is perpendicular to the radius through that point.. Learning objective: Apply the tangent-radius perpendicular theorem in proofs.. Tags: tangent, radius, proof","Theory: Tangent Perpendicular to Radius Circles Tangent Perpendicular to Radius easy Concept: Tangent Perpendicular to Radius. Description: Use the theorem that the tangent at a point of a circle is perpendicular to the radius through that point.. Learning objective: Apply the tangent-radius perpendicular theorem in proofs.. Tags: tangent, radius, proof",theory::c_tangent_radius_perpendicular
theory::c_tangents_from_external_point,theory,c_tangents_from_external_point,ch_circles,Circles,c_tangents_from_external_point,Tangents from an External Point,medium,Theory: Tangents from an External Point,"Concept: Tangents from an External Point. Description: Use the theorem that tangents drawn from an external point to a circle are equal in length.. Learning objective: Solve equal-tangent problems from an external point.. Tags: tangent_lengths, circles, theorem","Theory: Tangents from an External Point Circles Tangents from an External Point medium Concept: Tangents from an External Point. Description: Use the theorem that tangents drawn from an external point to a circle are equal in length.. Learning objective: Solve equal-tangent problems from an external point.. Tags: tangent_lengths, circles, theorem",theory::c_tangents_from_external_point
theory::c_trigonometric_ratios,theory,c_trigonometric_ratios,ch_trigonometry,Introduction to Trigonometry,c_trigonometric_ratios,Trigonometric Ratios,easy,Theory: Trigonometric Ratios,"Concept: Trigonometric Ratios. Description: Define sine, cosine, tangent and related ratios for an acute angle in a right-angled triangle.. Learning objective: Compute and interpret trigonometric ratios from triangle sides.. Tags: sin, cos, tan","Theory: Trigonometric Ratios Introduction to Trigonometry Trigonometric Ratios easy Concept: Trigonometric Ratios. Description: Define sine, cosine, tangent and related ratios for an acute angle in a right-angled triangle.. Learning objective: Compute and interpret trigonometric ratios from triangle sides.. Tags: sin, cos, tan",theory::c_trigonometric_ratios
