chunk_id,chunk_type,source_id,chapter_id,chapter_name,concept_id,concept_name,difficulty,title,content,search_text,doc_id
curriculum_note::c_pair_linear_equations_algebraic,syllabus_textbook_grounded,curriculum_note::c_pair_linear_equations_algebraic,ch_pair_linear_equations,Pair of Linear Equations in Two Variables,c_pair_linear_equations_algebraic,Algebraic Methods for Pair of Linear Equations,medium,Theory Note: Algebraic Methods for Pair of Linear Equations,"Summary: Algebraic Methods for Pair of Linear Equations belongs to the NCERT Class X chapter Pair of Linear Equations in Two Variables. The official syllabus expects students to solve two-variable linear systems algebraically and in context. In the NCERT textbook, this aligns with Algebraic Methods of Solving a Pair of Linear Equations. Graphical solution, consistency or inconsistency, substitution, elimination, and simple situational problems. Core concept description: Solve linear systems by substitution or elimination and apply them in simple situational problems.. Official syllabus: Graphical solution, consistency or inconsistency, substitution, elimination, and simple situational problems.. Textbook sections: Algebraic Methods of Solving a Pair of Linear Equations","Theory Note: Algebraic Methods for Pair of Linear Equations Pair of Linear Equations in Two Variables Algebraic Methods for Pair of Linear Equations medium Summary: Algebraic Methods for Pair of Linear Equations belongs to the NCERT Class X chapter Pair of Linear Equations in Two Variables. The official syllabus expects students to solve two-variable linear systems algebraically and in context. In the NCERT textbook, this aligns with Algebraic Methods of Solving a Pair of Linear Equations. Graphical solution, consistency or inconsistency, substitution, elimination, and simple situational problems. Core concept description: Solve linear systems by substitution or elimination and apply them in simple situational problems.. Official syllabus: Graphical solution, consistency or inconsistency, substitution, elimination, and simple situational problems.. Textbook sections: Algebraic Methods of Solving a Pair of Linear Equations",curriculum_note::c_pair_linear_equations_algebraic
curriculum_note::c_pair_linear_equations_consistency,syllabus_textbook_grounded,curriculum_note::c_pair_linear_equations_consistency,ch_pair_linear_equations,Pair of Linear Equations in Two Variables,c_pair_linear_equations_consistency,Consistency and Number of Solutions,medium,Theory Note: Consistency and Number of Solutions,"Summary: Consistency and Number of Solutions belongs to the NCERT Class X chapter Pair of Linear Equations in Two Variables. The official syllabus expects students to classify a pair of equations by its number of solutions. In the NCERT textbook, this aligns with Graphical Method of Solution of a Pair of Linear Equations, Algebraic Methods of Solving a Pair of Linear Equations. Graphical solution, consistency or inconsistency, substitution, elimination, and simple situational problems. Core concept description: Use coefficient conditions and graph interpretation to determine whether a system is consistent, inconsistent, or dependent.. Official syllabus: Graphical solution, consistency or inconsistency, substitution, elimination, and simple situational problems.. Textbook sections: Graphical Method of Solution of a Pair of Linear Equations, Algebraic Methods of Solving a Pair of Linear Equations","Theory Note: Consistency and Number of Solutions Pair of Linear Equations in Two Variables Consistency and Number of Solutions medium Summary: Consistency and Number of Solutions belongs to the NCERT Class X chapter Pair of Linear Equations in Two Variables. The official syllabus expects students to classify a pair of equations by its number of solutions. In the NCERT textbook, this aligns with Graphical Method of Solution of a Pair of Linear Equations, Algebraic Methods of Solving a Pair of Linear Equations. Graphical solution, consistency or inconsistency, substitution, elimination, and simple situational problems. Core concept description: Use coefficient conditions and graph interpretation to determine whether a system is consistent, inconsistent, or dependent.. Official syllabus: Graphical solution, consistency or inconsistency, substitution, elimination, and simple situational problems.. Textbook sections: Graphical Method of Solution of a Pair of Linear Equations, Algebraic Methods of Solving a Pair of Linear Equations",curriculum_note::c_pair_linear_equations_consistency
curriculum_note::c_pair_linear_equations_graphical,syllabus_textbook_grounded,curriculum_note::c_pair_linear_equations_graphical,ch_pair_linear_equations,Pair of Linear Equations in Two Variables,c_pair_linear_equations_graphical,Graphical Solution of Pair of Linear Equations,medium,Theory Note: Graphical Solution of Pair of Linear Equations,"Summary: Graphical Solution of Pair of Linear Equations belongs to the NCERT Class X chapter Pair of Linear Equations in Two Variables. The official syllabus expects students to use graphs to solve linear systems and interpret geometric meaning. In the NCERT textbook, this aligns with Graphical Method of Solution of a Pair of Linear Equations. Graphical solution, consistency or inconsistency, substitution, elimination, and simple situational problems. Core concept description: Represent two linear equations on the Cartesian plane and interpret their point of intersection.. Official syllabus: Graphical solution, consistency or inconsistency, substitution, elimination, and simple situational problems.. Textbook sections: Graphical Method of Solution of a Pair of Linear Equations","Theory Note: Graphical Solution of Pair of Linear Equations Pair of Linear Equations in Two Variables Graphical Solution of Pair of Linear Equations medium Summary: Graphical Solution of Pair of Linear Equations belongs to the NCERT Class X chapter Pair of Linear Equations in Two Variables. The official syllabus expects students to use graphs to solve linear systems and interpret geometric meaning. In the NCERT textbook, this aligns with Graphical Method of Solution of a Pair of Linear Equations. Graphical solution, consistency or inconsistency, substitution, elimination, and simple situational problems. Core concept description: Represent two linear equations on the Cartesian plane and interpret their point of intersection.. Official syllabus: Graphical solution, consistency or inconsistency, substitution, elimination, and simple situational problems.. Textbook sections: Graphical Method of Solution of a Pair of Linear Equations",curriculum_note::c_pair_linear_equations_graphical
curriculum_note::c_factorisation_remainder,syllabus_textbook_grounded,curriculum_note::c_factorisation_remainder,ch_polynomials,Polynomials,c_factorisation_remainder,Factorisation and Remainder Theorem,medium,Theory Note: Factorisation and Remainder Theorem,"Summary: Factorisation and Remainder Theorem belongs to the NCERT Class X chapter Polynomials. The official syllabus expects students to test factors efficiently while linking factorization to roots. In the NCERT textbook, this aligns with Division Algorithm for Polynomials. Zeros of a polynomial and relationship between zeroes and coefficients of quadratic polynomials. Core concept description: Use polynomial evaluation and factor checks as a supporting skill for zero-based reasoning.. Official syllabus: Zeros of a polynomial and relationship between zeroes and coefficients of quadratic polynomials.. Textbook sections: Division Algorithm for Polynomials","Theory Note: Factorisation and Remainder Theorem Polynomials Factorisation and Remainder Theorem medium Summary: Factorisation and Remainder Theorem belongs to the NCERT Class X chapter Polynomials. The official syllabus expects students to test factors efficiently while linking factorization to roots. In the NCERT textbook, this aligns with Division Algorithm for Polynomials. Zeros of a polynomial and relationship between zeroes and coefficients of quadratic polynomials. Core concept description: Use polynomial evaluation and factor checks as a supporting skill for zero-based reasoning.. Official syllabus: Zeros of a polynomial and relationship between zeroes and coefficients of quadratic polynomials.. Textbook sections: Division Algorithm for Polynomials",curriculum_note::c_factorisation_remainder
curriculum_note::c_polynomial_degree_terms,syllabus_textbook_grounded,curriculum_note::c_polynomial_degree_terms,ch_polynomials,Polynomials,c_polynomial_degree_terms,Polynomial Degree and Terms,medium,Theory Note: Polynomial Degree and Terms,"Summary: Polynomial Degree and Terms belongs to the NCERT Class X chapter Polynomials. The official syllabus expects students to read polynomial structure before applying class x zero-based reasoning. In the NCERT textbook, this aligns with Introduction to Polynomials. Zeros of a polynomial and relationship between zeroes and coefficients of quadratic polynomials. Core concept description: Review polynomial vocabulary including terms, coefficients, and degree as scaffolding for root analysis.. Official syllabus: Zeros of a polynomial and relationship between zeroes and coefficients of quadratic polynomials.. Textbook sections: Introduction to Polynomials","Theory Note: Polynomial Degree and Terms Polynomials Polynomial Degree and Terms medium Summary: Polynomial Degree and Terms belongs to the NCERT Class X chapter Polynomials. The official syllabus expects students to read polynomial structure before applying class x zero-based reasoning. In the NCERT textbook, this aligns with Introduction to Polynomials. Zeros of a polynomial and relationship between zeroes and coefficients of quadratic polynomials. Core concept description: Review polynomial vocabulary including terms, coefficients, and degree as scaffolding for root analysis.. Official syllabus: Zeros of a polynomial and relationship between zeroes and coefficients of quadratic polynomials.. Textbook sections: Introduction to Polynomials",curriculum_note::c_polynomial_degree_terms
curriculum_note::c_zero_coeff_relationship,syllabus_textbook_grounded,curriculum_note::c_zero_coeff_relationship,ch_polynomials,Polynomials,c_zero_coeff_relationship,Relationship Between Zeroes and Coefficients,medium,Theory Note: Relationship Between Zeroes and Coefficients,"Summary: Relationship Between Zeroes and Coefficients belongs to the NCERT Class X chapter Polynomials. The official syllabus expects students to construct or analyze quadratic polynomials using root-coefficient relationships. In the NCERT textbook, this aligns with Relationship between Zeroes and Coefficients of a Polynomial. Zeros of a polynomial and relationship between zeroes and coefficients of quadratic polynomials. Core concept description: Use the sum and product of zeroes to connect quadratic roots with coefficients.. Official syllabus: Zeros of a polynomial and relationship between zeroes and coefficients of quadratic polynomials.. Textbook sections: Relationship between Zeroes and Coefficients of a Polynomial","Theory Note: Relationship Between Zeroes and Coefficients Polynomials Relationship Between Zeroes and Coefficients medium Summary: Relationship Between Zeroes and Coefficients belongs to the NCERT Class X chapter Polynomials. The official syllabus expects students to construct or analyze quadratic polynomials using root-coefficient relationships. In the NCERT textbook, this aligns with Relationship between Zeroes and Coefficients of a Polynomial. Zeros of a polynomial and relationship between zeroes and coefficients of quadratic polynomials. Core concept description: Use the sum and product of zeroes to connect quadratic roots with coefficients.. Official syllabus: Zeros of a polynomial and relationship between zeroes and coefficients of quadratic polynomials.. Textbook sections: Relationship between Zeroes and Coefficients of a Polynomial",curriculum_note::c_zero_coeff_relationship
curriculum_note::c_zeroes_of_polynomial,syllabus_textbook_grounded,curriculum_note::c_zeroes_of_polynomial,ch_polynomials,Polynomials,c_zeroes_of_polynomial,Zeroes of a Polynomial,medium,Theory Note: Zeroes of a Polynomial,"Summary: Zeroes of a Polynomial belongs to the NCERT Class X chapter Polynomials. The official syllabus expects students to compute and reason about polynomial zeroes from algebraic forms. In the NCERT textbook, this aligns with Geometrical Meaning of the Zeroes of a Polynomial. Zeros of a polynomial and relationship between zeroes and coefficients of quadratic polynomials. Core concept description: Find and interpret the zeroes of a polynomial in line with the official Class X syllabus.. Official syllabus: Zeros of a polynomial and relationship between zeroes and coefficients of quadratic polynomials.. Textbook sections: Geometrical Meaning of the Zeroes of a Polynomial","Theory Note: Zeroes of a Polynomial Polynomials Zeroes of a Polynomial medium Summary: Zeroes of a Polynomial belongs to the NCERT Class X chapter Polynomials. The official syllabus expects students to compute and reason about polynomial zeroes from algebraic forms. In the NCERT textbook, this aligns with Geometrical Meaning of the Zeroes of a Polynomial. Zeros of a polynomial and relationship between zeroes and coefficients of quadratic polynomials. Core concept description: Find and interpret the zeroes of a polynomial in line with the official Class X syllabus.. Official syllabus: Zeros of a polynomial and relationship between zeroes and coefficients of quadratic polynomials.. Textbook sections: Geometrical Meaning of the Zeroes of a Polynomial",curriculum_note::c_zeroes_of_polynomial
curriculum_note::c_classical_probability,syllabus_textbook_grounded,curriculum_note::c_classical_probability,ch_probability,Probability,c_classical_probability,Classical Probability,medium,Theory Note: Classical Probability,"Summary: Classical Probability belongs to the NCERT Class X chapter Probability. The official syllabus expects students to solve introductory probability problems using the classical definition. In the NCERT textbook, this aligns with Probability — A Theoretical Approach. Classical definition of probability and simple event problems. Core concept description: Use favorable outcomes over total equally likely outcomes to compute simple probabilities.. Official syllabus: Classical definition of probability and simple event problems.. Textbook sections: Probability — A Theoretical Approach","Theory Note: Classical Probability Probability Classical Probability medium Summary: Classical Probability belongs to the NCERT Class X chapter Probability. The official syllabus expects students to solve introductory probability problems using the classical definition. In the NCERT textbook, this aligns with Probability — A Theoretical Approach. Classical definition of probability and simple event problems. Core concept description: Use favorable outcomes over total equally likely outcomes to compute simple probabilities.. Official syllabus: Classical definition of probability and simple event problems.. Textbook sections: Probability — A Theoretical Approach",curriculum_note::c_classical_probability
curriculum_note::c_discriminant_nature_roots,syllabus_textbook_grounded,curriculum_note::c_discriminant_nature_roots,ch_quadratic_equations,Quadratic Equations,c_discriminant_nature_roots,Discriminant and Nature of Roots,medium,Theory Note: Discriminant and Nature of Roots,"Summary: Discriminant and Nature of Roots belongs to the NCERT Class X chapter Quadratic Equations. The official syllabus expects students to relate discriminant value to the nature of quadratic roots. In the NCERT textbook, this aligns with Nature of Roots. Standard form, factorization, quadratic formula, discriminant, and situational problems. Core concept description: Use the discriminant to infer whether a quadratic equation has distinct, repeated, or no real roots.. Official syllabus: Standard form, factorization, quadratic formula, discriminant, and situational problems.. Textbook sections: Nature of Roots","Theory Note: Discriminant and Nature of Roots Quadratic Equations Discriminant and Nature of Roots medium Summary: Discriminant and Nature of Roots belongs to the NCERT Class X chapter Quadratic Equations. The official syllabus expects students to relate discriminant value to the nature of quadratic roots. In the NCERT textbook, this aligns with Nature of Roots. Standard form, factorization, quadratic formula, discriminant, and situational problems. Core concept description: Use the discriminant to infer whether a quadratic equation has distinct, repeated, or no real roots.. Official syllabus: Standard form, factorization, quadratic formula, discriminant, and situational problems.. Textbook sections: Nature of Roots",curriculum_note::c_discriminant_nature_roots
curriculum_note::c_quadratic_applications,syllabus_textbook_grounded,curriculum_note::c_quadratic_applications,ch_quadratic_equations,Quadratic Equations,c_quadratic_applications,Situational Problems on Quadratic Equations,medium,Theory Note: Situational Problems on Quadratic Equations,"Summary: Situational Problems on Quadratic Equations belongs to the NCERT Class X chapter Quadratic Equations. The official syllabus expects students to model simple real-life situations using quadratic equations. In the NCERT textbook, this aligns with Quadratic Equations, Solution of a Quadratic Equation by Factorisation, Nature of Roots. Standard form, factorization, quadratic formula, discriminant, and situational problems. Core concept description: Translate day-to-day contexts into quadratic equations and solve them with an appropriate method.. Official syllabus: Standard form, factorization, quadratic formula, discriminant, and situational problems.. Textbook sections: Quadratic Equations, Solution of a Quadratic Equation by Factorisation, Nature of Roots","Theory Note: Situational Problems on Quadratic Equations Quadratic Equations Situational Problems on Quadratic Equations medium Summary: Situational Problems on Quadratic Equations belongs to the NCERT Class X chapter Quadratic Equations. The official syllabus expects students to model simple real-life situations using quadratic equations. In the NCERT textbook, this aligns with Quadratic Equations, Solution of a Quadratic Equation by Factorisation, Nature of Roots. Standard form, factorization, quadratic formula, discriminant, and situational problems. Core concept description: Translate day-to-day contexts into quadratic equations and solve them with an appropriate method.. Official syllabus: Standard form, factorization, quadratic formula, discriminant, and situational problems.. Textbook sections: Quadratic Equations, Solution of a Quadratic Equation by Factorisation, Nature of Roots",curriculum_note::c_quadratic_applications
curriculum_note::c_quadratic_factorization,syllabus_textbook_grounded,curriculum_note::c_quadratic_factorization,ch_quadratic_equations,Quadratic Equations,c_quadratic_factorization,Quadratic Equations by Factorization,medium,Theory Note: Quadratic Equations by Factorization,"Summary: Quadratic Equations by Factorization belongs to the NCERT Class X chapter Quadratic Equations. The official syllabus expects students to solve suitable quadratic equations by factorization. In the NCERT textbook, this aligns with Quadratic Equations, Solution of a Quadratic Equation by Factorisation. Standard form, factorization, quadratic formula, discriminant, and situational problems. Core concept description: Solve quadratic equations with real roots by expressing the polynomial as a product of linear factors.. Official syllabus: Standard form, factorization, quadratic formula, discriminant, and situational problems.. Textbook sections: Quadratic Equations, Solution of a Quadratic Equation by Factorisation","Theory Note: Quadratic Equations by Factorization Quadratic Equations Quadratic Equations by Factorization medium Summary: Quadratic Equations by Factorization belongs to the NCERT Class X chapter Quadratic Equations. The official syllabus expects students to solve suitable quadratic equations by factorization. In the NCERT textbook, this aligns with Quadratic Equations, Solution of a Quadratic Equation by Factorisation. Standard form, factorization, quadratic formula, discriminant, and situational problems. Core concept description: Solve quadratic equations with real roots by expressing the polynomial as a product of linear factors.. Official syllabus: Standard form, factorization, quadratic formula, discriminant, and situational problems.. Textbook sections: Quadratic Equations, Solution of a Quadratic Equation by Factorisation",curriculum_note::c_quadratic_factorization
curriculum_note::c_quadratic_formula,syllabus_textbook_grounded,curriculum_note::c_quadratic_formula,ch_quadratic_equations,Quadratic Equations,c_quadratic_formula,Quadratic Formula,medium,Theory Note: Quadratic Formula,"Summary: Quadratic Formula belongs to the NCERT Class X chapter Quadratic Equations. The official syllabus expects students to apply the quadratic formula accurately to class x equations. In the NCERT textbook, this aligns with Quadratic Equations. Standard form, factorization, quadratic formula, discriminant, and situational problems. Core concept description: Use the quadratic formula to solve any quadratic equation with real roots in standard form.. Official syllabus: Standard form, factorization, quadratic formula, discriminant, and situational problems.. Textbook sections: Quadratic Equations","Theory Note: Quadratic Formula Quadratic Equations Quadratic Formula medium Summary: Quadratic Formula belongs to the NCERT Class X chapter Quadratic Equations. The official syllabus expects students to apply the quadratic formula accurately to class x equations. In the NCERT textbook, this aligns with Quadratic Equations. Standard form, factorization, quadratic formula, discriminant, and situational problems. Core concept description: Use the quadratic formula to solve any quadratic equation with real roots in standard form.. Official syllabus: Standard form, factorization, quadratic formula, discriminant, and situational problems.. Textbook sections: Quadratic Equations",curriculum_note::c_quadratic_formula
curriculum_note::c_decimal_expansions,syllabus_textbook_grounded,curriculum_note::c_decimal_expansions,ch_real_numbers,Real Numbers,c_decimal_expansions,Decimal Expansions of Rational Numbers,medium,Theory Note: Decimal Expansions of Rational Numbers,"Summary: Decimal Expansions of Rational Numbers belongs to the NCERT Class X chapter Real Numbers. The official syllabus expects students to explain decimal behavior of rational numbers from prime factors of the denominator. In the NCERT textbook, this aligns with Revisiting Rational Numbers and Their Decimal Expansions. Fundamental Theorem of Arithmetic, irrationality, and decimal expansions of rational numbers. Core concept description: Classify rational numbers by terminating or recurring decimal expansion through denominator factorization.. Official syllabus: Fundamental Theorem of Arithmetic, irrationality, and decimal expansions of rational numbers.. Textbook sections: Revisiting Rational Numbers and Their Decimal Expansions","Theory Note: Decimal Expansions of Rational Numbers Real Numbers Decimal Expansions of Rational Numbers medium Summary: Decimal Expansions of Rational Numbers belongs to the NCERT Class X chapter Real Numbers. The official syllabus expects students to explain decimal behavior of rational numbers from prime factors of the denominator. In the NCERT textbook, this aligns with Revisiting Rational Numbers and Their Decimal Expansions. Fundamental Theorem of Arithmetic, irrationality, and decimal expansions of rational numbers. Core concept description: Classify rational numbers by terminating or recurring decimal expansion through denominator factorization.. Official syllabus: Fundamental Theorem of Arithmetic, irrationality, and decimal expansions of rational numbers.. Textbook sections: Revisiting Rational Numbers and Their Decimal Expansions",curriculum_note::c_decimal_expansions
curriculum_note::c_euclid_division_lemma,syllabus_textbook_grounded,curriculum_note::c_euclid_division_lemma,ch_real_numbers,Real Numbers,c_euclid_division_lemma,Euclid Division Lemma,medium,Theory Note: Euclid Division Lemma,"Summary: Euclid Division Lemma belongs to the NCERT Class X chapter Real Numbers. The official syllabus expects students to use euclid-style quotient and remainder decomposition as a bridge into hcf computations. In the NCERT textbook, this aligns with Introduction. Fundamental Theorem of Arithmetic, irrationality, and decimal expansions of rational numbers. Core concept description: Represent an integer as a = bq + r and use that decomposition to support HCF reasoning.. Official syllabus: Fundamental Theorem of Arithmetic, irrationality, and decimal expansions of rational numbers.. Textbook sections: Introduction","Theory Note: Euclid Division Lemma Real Numbers Euclid Division Lemma medium Summary: Euclid Division Lemma belongs to the NCERT Class X chapter Real Numbers. The official syllabus expects students to use euclid-style quotient and remainder decomposition as a bridge into hcf computations. In the NCERT textbook, this aligns with Introduction. Fundamental Theorem of Arithmetic, irrationality, and decimal expansions of rational numbers. Core concept description: Represent an integer as a = bq + r and use that decomposition to support HCF reasoning.. Official syllabus: Fundamental Theorem of Arithmetic, irrationality, and decimal expansions of rational numbers.. Textbook sections: Introduction",curriculum_note::c_euclid_division_lemma
